{
  "artifact_type": "command-registry",
  "registry_format_version": 1,
  "generated_at": "2026-06-20T14:58:27.777Z",
  "detail_ref": "docs/cli-reference.md",
  "commands": [
    {
      "command": "actor-assignment-evaluation-record",
      "category": "write",
      "purpose": "Evaluate an actor skill packet into selected, degraded, blocked, or escalated assignment state.",
      "operator_path": "artifact-recording",
      "top_command": false,
      "inputs": [
        "project",
        "actor-skill-packet-ref",
        "write-artifact?"
      ],
      "outputs": [
        "actor assignment evaluation artifact"
      ],
      "detail_ref": "docs/cli-reference.md"
    },
    {
      "command": "actor-execution-gate-record",
      "category": "write",
      "purpose": "Gate a selected actor assignment against required resource claims and policy evaluation evidence.",
      "operator_path": "artifact-recording",
      "top_command": false,
      "inputs": [
        "project",
        "actor-assignment-evaluation-ref",
        "resource-claim-ref",
        "policy-evaluation-ref",
        "write-artifact?"
      ],
      "outputs": [
        "actor execution gate artifact"
      ],
      "detail_ref": "docs/cli-reference.md"
    },
    {
      "command": "actor-skill-packet-record",
      "category": "write",
      "purpose": "Write a schema-valid actor skill packet with assignment, skill, capability, resource, policy, review, blocker, HRI, and provenance evidence.",
      "operator_path": "artifact-recording",
      "top_command": false,
      "inputs": [
        "project",
        "objective",
        "role-ref",
        "skill-ref",
        "capability-fit-json",
        "source-task-id",
        "source-parent-session-id",
        "write-artifact?"
      ],
      "outputs": [
        "actor skill packet artifact"
      ],
      "detail_ref": "docs/cli-reference.md"
    },
    {
      "command": "alignment-pulse",
      "category": "execute",
      "purpose": "Advance the runtime through alignment pulse.",
      "operator_path": "runtime-execution",
      "top_command": false,
      "inputs": [],
      "outputs": [],
      "detail_ref": "docs/cli-reference.md"
    },
    {
      "command": "allocation-plan-record",
      "category": "write",
      "purpose": "Write the canonical allocation plan record artifact.",
      "operator_path": "artifact-recording",
      "top_command": false,
      "inputs": [],
      "outputs": [],
      "detail_ref": "docs/cli-reference.md"
    },
    {
      "command": "alternative-analysis-record",
      "category": "write",
      "purpose": "Write the canonical alternative analysis record artifact.",
      "operator_path": "artifact-recording",
      "top_command": false,
      "inputs": [],
      "outputs": [],
      "detail_ref": "docs/cli-reference.md"
    },
    {
      "command": "anomaly-log-record",
      "category": "write",
      "purpose": "Write the canonical anomaly log record artifact.",
      "operator_path": "artifact-recording",
      "top_command": false,
      "inputs": [],
      "outputs": [],
      "detail_ref": "docs/cli-reference.md"
    },
    {
      "command": "answer",
      "category": "execute",
      "purpose": "Advance the runtime through answer.",
      "operator_path": "runtime-execution",
      "top_command": false,
      "inputs": [],
      "outputs": [],
      "detail_ref": "docs/cli-reference.md"
    },
    {
      "command": "assumption-map-record",
      "category": "write",
      "purpose": "Write the canonical assumption map record artifact.",
      "operator_path": "artifact-recording",
      "top_command": false,
      "inputs": [],
      "outputs": [],
      "detail_ref": "docs/cli-reference.md"
    },
    {
      "command": "breakthrough-library-register",
      "category": "read",
      "purpose": "Read the current breakthrough library register surface.",
      "operator_path": "state-inspection",
      "top_command": false,
      "inputs": [],
      "outputs": [],
      "detail_ref": "docs/cli-reference.md"
    },
    {
      "command": "breakthrough-pattern-record",
      "category": "write",
      "purpose": "Write the canonical breakthrough pattern record artifact.",
      "operator_path": "artifact-recording",
      "top_command": false,
      "inputs": [],
      "outputs": [],
      "detail_ref": "docs/cli-reference.md"
    },
    {
      "command": "cadence-follow-through",
      "category": "execute",
      "purpose": "Advance the runtime through cadence follow through.",
      "operator_path": "runtime-execution",
      "top_command": false,
      "inputs": [],
      "outputs": [],
      "detail_ref": "docs/cli-reference.md"
    },
    {
      "command": "cadence-trigger-guide",
      "category": "execute",
      "purpose": "Advance the runtime through cadence trigger guide.",
      "operator_path": "runtime-execution",
      "top_command": false,
      "inputs": [],
      "outputs": [],
      "detail_ref": "docs/cli-reference.md"
    },
    {
      "command": "command-register",
      "category": "read",
      "purpose": "Read the command registry so operators and AI can route without loading the full CLI reference.",
      "operator_path": "top-level-routing",
      "top_command": true,
      "inputs": [
        "project"
      ],
      "outputs": [
        "command routing summary"
      ],
      "detail_ref": "docs/cli-reference.md"
    },
    {
      "command": "command-registry-refresh",
      "category": "execute",
      "purpose": "Write the canonical command registry artifact from the CLI command catalog.",
      "operator_path": "runtime-execution",
      "top_command": false,
      "inputs": [
        "project",
        "write-artifact?"
      ],
      "outputs": [
        "command registry artifact"
      ],
      "detail_ref": "docs/cli-reference.md"
    },
    {
      "command": "command-routing-audit",
      "category": "verify",
      "purpose": "Verify that bootstrap, orientation, and command registry routing surfaces remain aligned.",
      "operator_path": "top-level-routing",
      "top_command": true,
      "inputs": [
        "project",
        "write-artifact?"
      ],
      "outputs": [
        "routing audit result"
      ],
      "detail_ref": "docs/cli-reference.md"
    },
    {
      "command": "confirmation-window-record",
      "category": "write",
      "purpose": "Write the canonical confirmation window record artifact.",
      "operator_path": "artifact-recording",
      "top_command": false,
      "inputs": [],
      "outputs": [],
      "detail_ref": "docs/cli-reference.md"
    },
    {
      "command": "contract-register",
      "category": "read",
      "purpose": "Read the current contract register surface.",
      "operator_path": "state-inspection",
      "top_command": false,
      "inputs": [],
      "outputs": [],
      "detail_ref": "docs/cli-reference.md"
    },
    {
      "command": "council",
      "category": "read",
      "purpose": "Read the current council surface.",
      "operator_path": "state-inspection",
      "top_command": false,
      "inputs": [],
      "outputs": [],
      "detail_ref": "docs/cli-reference.md"
    },
    {
      "command": "council-exec",
      "category": "execute",
      "purpose": "Execute a council stage and optionally invoke model-backed seats.",
      "operator_path": "top-level-routing",
      "top_command": true,
      "inputs": [
        "session",
        "stage",
        "project?"
      ],
      "outputs": [
        "council execution packet"
      ],
      "detail_ref": "docs/cli-reference.md"
    },
    {
      "command": "council-review-packet",
      "category": "execute",
      "purpose": "Advance the runtime through council review packet.",
      "operator_path": "runtime-execution",
      "top_command": false,
      "inputs": [],
      "outputs": [],
      "detail_ref": "docs/cli-reference.md"
    },
    {
      "command": "decision-register",
      "category": "read",
      "purpose": "Read the current decision register surface.",
      "operator_path": "state-inspection",
      "top_command": false,
      "inputs": [],
      "outputs": [],
      "detail_ref": "docs/cli-reference.md"
    },
    {
      "command": "decision-verify",
      "category": "verify",
      "purpose": "Verify decision verify integrity and governed correctness.",
      "operator_path": "integrity-and-benchmarking",
      "top_command": false,
      "inputs": [],
      "outputs": [],
      "detail_ref": "docs/cli-reference.md"
    },
    {
      "command": "dependency-graph",
      "category": "read",
      "purpose": "Read the current dependency graph surface.",
      "operator_path": "state-inspection",
      "top_command": false,
      "inputs": [],
      "outputs": [],
      "detail_ref": "docs/cli-reference.md"
    },
    {
      "command": "discovery-handoff-benchmark",
      "category": "verify",
      "purpose": "Verify discovery handoff benchmark integrity and governed correctness.",
      "operator_path": "integrity-and-benchmarking",
      "top_command": false,
      "inputs": [],
      "outputs": [],
      "detail_ref": "docs/cli-reference.md"
    },
    {
      "command": "discovery-handoff-record",
      "category": "write",
      "purpose": "Write the canonical discovery handoff record artifact.",
      "operator_path": "artifact-recording",
      "top_command": false,
      "inputs": [],
      "outputs": [],
      "detail_ref": "docs/cli-reference.md"
    },
    {
      "command": "discovery-judgment-packet",
      "category": "execute",
      "purpose": "Advance the runtime through discovery judgment packet.",
      "operator_path": "runtime-execution",
      "top_command": false,
      "inputs": [],
      "outputs": [],
      "detail_ref": "docs/cli-reference.md"
    },
    {
      "command": "discovery-question-set-record",
      "category": "write",
      "purpose": "Write the canonical discovery question set record artifact.",